[
  {
    "problem": "Erdős–Straus conjecture",
    "category": "number_theory",
    "known_partial_results_url": "https://en.wikipedia.org/wiki/Erd%C5%91s%E2%80%93Straus_conjecture",
    "machinery_required": [
      "python_3.12",
      "mpmath_500dps",
      "gmpy2",
      "sympy_cas"
    ],
    "machinery_available_locally": true,
    "falsifiable_sub_question": "Extend computational verification of 4/n = 1/x + 1/y + 1/z to N > 10^17 (current bound) via residue-class CRT covers + targeted decomposition for residue classes not covered by the standard 4-cover; either (a) verify N up to 10^18 with cover working, OR (b) document a residue class in [10^17, 10^18] that escapes all known covers.",
    "estimated_compute_to_partial_result_hours": 72,
    "publishability_of_negative_result": "medium",
    "AEAL_compliance_risk": "low"
  },
  {
    "problem": "Brocard's problem (n! + 1 = m²)",
    "category": "number_theory",
    "known_partial_results_url": "https://en.wikipedia.org/wiki/Brocard%27s_problem",
    "machinery_required": [
      "python_3.12",
      "mpmath_500dps",
      "gmpy2",
      "sympy_cas"
    ],
    "machinery_available_locally": true,
    "falsifiable_sub_question": "Extend computational search for n! + 1 = m² past current N = 10^9 to N = 10^{10}–10^{11}; either (a) find a new Brown number (n, m) with n > 7, OR (b) verify absence in extended range using modular sieving + factorial-tail Legendre-residue analysis.",
    "estimated_compute_to_partial_result_hours": 50,
    "publishability_of_negative_result": "low",
    "AEAL_compliance_risk": "low"
  },
  {
    "problem": "Erdős–Moser equation (1^k + 2^k + ... + (m-1)^k = m^k)",
    "category": "number_theory",
    "known_partial_results_url": "https://en.wikipedia.org/wiki/Erd%C5%91s%E2%80%93Moser_equation",
    "machinery_required": [
      "python_3.12",
      "mpmath_500dps",
      "gmpy2",
      "sympy_cas"
    ],
    "machinery_available_locally": true,
    "falsifiable_sub_question": "Extend the von Staudt–Clausen + p-adic exclusion lower bound past current m > 10^9 to m > 10^{10}; document any near-failures of the exclusion argument in the extended range and the smallest m for which exclusion certifies absence of nontrivial solution.",
    "estimated_compute_to_partial_result_hours": 90,
    "publishability_of_negative_result": "medium",
    "AEAL_compliance_risk": "low"
  },
  {
    "problem": "Pillai-style consecutive perfect-power gap conjectures",
    "category": "number_theory",
    "known_partial_results_url": "https://en.wikipedia.org/wiki/Pillai%27s_conjecture",
    "machinery_required": [
      "python_3.12",
      "mpmath_500dps",
      "gmpy2"
    ],
    "machinery_available_locally": true,
    "falsifiable_sub_question": "Extend the perfect-power gap-statistics enumeration up to N = 10^{19}; identify any new high-gap candidates exceeding the current record, with each candidate independently verified by recomputation in a separate session.",
    "estimated_compute_to_partial_result_hours": 45,
    "publishability_of_negative_result": "low",
    "AEAL_compliance_risk": "low"
  },
  {
    "problem": "Beal conjecture for fixed signature (p, q, r)",
    "category": "number_theory",
    "known_partial_results_url": "https://en.wikipedia.org/wiki/Beal_conjecture",
    "machinery_required": [
      "python_3.12",
      "mpmath_500dps",
      "gmpy2"
    ],
    "machinery_available_locally": true,
    "falsifiable_sub_question": "For one specific signature (p, q, r) where no proof exists (e.g., (4, 5, 6) or (5, 5, 7)), extend A^p + B^q = C^r enumeration past max(A, B, C) > 10^7 to 10^9 with high-precision sieving over coprime triples; either find a counterexample (signature-specific Beal disproof) or document absence in extended range.",
    "estimated_compute_to_partial_result_hours": 60,
    "publishability_of_negative_result": "medium",
    "AEAL_compliance_risk": "low"
  },
  {
    "problem": "Lehmer's totient problem (φ(n) | n − 1 ⇒ n prime?)",
    "category": "number_theory",
    "known_partial_results_url": "https://en.wikipedia.org/wiki/Lehmer%27s_totient_problem",
    "machinery_required": [
      "python_3.12",
      "mpmath_500dps",
      "gmpy2",
      "pari_gp_shellout",
      "pari_factor_moderate"
    ],
    "machinery_available_locally": true,
    "falsifiable_sub_question": "Extend the lower bound ω(n) ≥ 14 (smallest prime-omega count of a non-prime n satisfying φ(n) | n − 1) via mpmath/gmpy2 sieving + PARI gp factor at moderate cofactor depths up to D = 10^{20}; document any candidate n in the extended range that survives the test.",
    "estimated_compute_to_partial_result_hours": 95,
    "publishability_of_negative_result": "medium",
    "AEAL_compliance_risk": "medium"
  },
  {
    "problem": "Cunningham project unfactored cofactor (fixed base, exponent class)",
    "category": "number_theory",
    "known_partial_results_url": "https://en.wikipedia.org/wiki/Cunningham_project",
    "machinery_required": [
      "nfs_factorization",
      "pari_factor_moderate"
    ],
    "machinery_available_locally": false,
    "falsifiable_sub_question": "Pick one base/exponent class where the cofactor is unfactored and document a precision-and-method audit of why current ECM/NFS attempts have stalled (capability-gap framing). NB: NFS is NOT in confirmed machinery base; this row is included to test the hard-filter behaviour — should be DROPPED at M1.2 selection per Brief §M1.1 sentence 3.",
    "estimated_compute_to_partial_result_hours": 0.5,
    "publishability_of_negative_result": "low",
    "AEAL_compliance_risk": "high"
  },
  {
    "problem": "Mertens function sign-change density",
    "category": "number_theory",
    "known_partial_results_url": "https://en.wikipedia.org/wiki/Mertens_function",
    "machinery_required": [
      "python_3.12",
      "mpmath_500dps",
      "gmpy2",
      "numpy"
    ],
    "machinery_available_locally": true,
    "falsifiable_sub_question": "Extend the tabulation of sign-change positions of M(n) = Σ_{k=1}^n μ(k) up to N = 10^{14} (current bound around 10^{13}); compute the sign-change density and compare against Lévy/Riemann-type predictions; document any sign-change cluster exceeding 3σ from expected.",
    "estimated_compute_to_partial_result_hours": 80,
    "publishability_of_negative_result": "medium",
    "AEAL_compliance_risk": "low"
  },
  {
    "problem": "Repunit primality density extension (R_n = (10^n − 1)/9)",
    "category": "number_theory",
    "known_partial_results_url": "https://en.wikipedia.org/wiki/Repunit",
    "machinery_required": [
      "python_3.12",
      "mpmath_500dps",
      "gmpy2",
      "sympy_cas"
    ],
    "machinery_available_locally": true,
    "falsifiable_sub_question": "Apply BPSW probable prime test (sympy.isprime) to R_n for n in a new range past the current verified bound; identify any new probable-prime R_n candidates and document the test trace at high precision to support promotion to deterministic primality verification.",
    "estimated_compute_to_partial_result_hours": 55,
    "publishability_of_negative_result": "low",
    "AEAL_compliance_risk": "low"
  },
  {
    "problem": "Zaremba's conjecture for alphabet A_5 = {1, 2, 3, 4, 5}",
    "category": "diophantine_approximation",
    "known_partial_results_url": "https://en.wikipedia.org/wiki/Zaremba%27s_conjecture",
    "machinery_required": [
      "python_3.12",
      "mpmath_500dps",
      "gmpy2",
      "sympy_cas"
    ],
    "machinery_available_locally": true,
    "falsifiable_sub_question": "Extend the Bourgain–Kontorovich density estimate of integers q with CF(q/p) bounded by A_5 = 5 to a new q-range [10^7, 10^9]; either find a q without such a p (Zaremba-disproof for A_5 at that q) or extend the density estimate with a documented lower bound.",
    "estimated_compute_to_partial_result_hours": 50,
    "publishability_of_negative_result": "medium",
    "AEAL_compliance_risk": "low"
  },
  {
    "problem": "Markov spectrum gap structure between 3 and Freiman's constant",
    "category": "diophantine_approximation",
    "known_partial_results_url": "https://en.wikipedia.org/wiki/Markov_spectrum",
    "machinery_required": [
      "python_3.12",
      "mpmath_500dps",
      "gmpy2"
    ],
    "machinery_available_locally": true,
    "falsifiable_sub_question": "Extend the tabulation of Markov triples (and corresponding spectrum values) past the current computational record; compute gap-residual statistics in the open region [3, F] where F ≈ 4.5278 is Freiman's constant; flag any apparent gap clusters.",
    "estimated_compute_to_partial_result_hours": 50,
    "publishability_of_negative_result": "medium",
    "AEAL_compliance_risk": "low"
  },
  {
    "problem": "Lagrange spectrum values past Freiman's constant",
    "category": "diophantine_approximation",
    "known_partial_results_url": "https://en.wikipedia.org/wiki/Lagrange_spectrum",
    "machinery_required": [
      "python_3.12",
      "mpmath_500dps",
      "gmpy2"
    ],
    "machinery_available_locally": true,
    "falsifiable_sub_question": "Extend computational enumeration of Lagrange-spectrum values above Freiman's constant (~4.5278) to resolution 10^{-6} on [4.5278, 4.6]; document the distribution and flag any candidate transition points (accumulation points beyond known structure).",
    "estimated_compute_to_partial_result_hours": 60,
    "publishability_of_negative_result": "medium",
    "AEAL_compliance_risk": "low"
  },
  {
    "problem": "Stern–Brocot tree gap distribution at large levels",
    "category": "diophantine_approximation",
    "known_partial_results_url": "https://en.wikipedia.org/wiki/Stern%E2%80%93Brocot_tree",
    "machinery_required": [
      "python_3.12",
      "mpmath_500dps",
      "gmpy2"
    ],
    "machinery_available_locally": true,